RIO;PONTOS;HORA_COLETA;GPS;TURBIDEZ (NTU);CONDUTIVIDADE;pH;TEMPERATURA;SOLIDOS D. T.;SALINIDADE;O. D;OBSERVACAO
CHAMAGUNGA;Ponto 1;9:57;"-16.40912879744533,-39.05111993068277";8.58;320;6.9;24.25;200;"0,01";4.7;"Coleta feita no fundo da escola mundai, o ox a foz sul, após a obra da prefeitura, então não houve nenhum interferência "
CHAMAGUNGA;Ponto 2;10:20;"-16.403179202241123,-39.04618809159306";3.00;;5.0;;;;;
CHAMAGUNGA;Ponto 3;19/05/2023 11:25;"-16.387572638647914,-39.04180054635663";7.30;116;6.19;"27,3";58;0;"3,2";Coletado na nascente do rio ao lado do muro do condomínio residencial recanto do lago
CHAMAGUNGA;Ponto 4;11:30;"-16.387572638647914,-39.04180054635663";7.57;116;11.5;"27,3";58;0;"3,2";Coletado na nascente do rio ao lado do muro do condomínio residencial recanto do lago
CHAMAGUNGA;Ponto 5;12:04;"-16.389745167429655,-39.040198902381604";26.7;239;6.77;"23,95";120;"0,01";"1,56";"Braço norte do rio, acima de uma ponte em frente ao psf"
CHAMAGUNGA;Ponto 6;12:04;"-16.389745167429655,-39.040198902381604";7.50;229;6.79;"25,95";120;"0,02";"1,59";"Braço norte do rio, ao lado do Sueds"
